{
    "account_id": "1456243",
    "created_at": "2015-12-16T00:34:47.000Z",
    "domains_count": 1,
    "id": "1552433",
    "metadata": {
        "documentation": "https://developer.unbounce.com/api_reference/#id_sub_accounts__sub_account_id_",
        "location": "https://api.unbounce.com/sub_accounts/1552433",
        "related": {
            "domains": "https://api.unbounce.com/sub_accounts/1552433/domains",
            "page_groups": "https://api.unbounce.com/sub_accounts/1552433/page_groups",
            "pages": "https://api.unbounce.com/sub_accounts/1552433/pages"
        }
    },
    "name": "Default Client"
}
